DATA / HORA,COLOCAÇÃO,NOME,OPÇÃO,CARGO,SUBÁREA,STATUS,UNIDADE,LOTAÇÃO,EVENTO,ALTERACOES
17/07/2026 - 06:47:34,7º AC,MATEUS DE OLIVEIRA GONCALVES,40002278,Analista,Engenharia de Infraestrutura e Tecnologia da Informação,Desistente,,,NOVO,
17/07/2026 - 06:47:34,4º PPP,MISAEL BATISTA FARIAS ARAUJO,40002271,Analista,"Administrativo, Suprimento, Manutenção e Serviços",Contratado,CPACP - Maranhão,São Luis,NOVO,
17/07/2026 - 06:47:34,5º PPP,MATHEUS GABRIEL SOARES AMORIM,40000007,Assistente,Manejo Animal,Contratado,CPAP - Pantanal,Corumbá,NOVO,
17/07/2026 - 06:47:34,3º AC,BRIGIDA DUARTE,40002553,Analista,Transferência de Tecnologia,Contratado,CNPH - Hortaliças,Brasília,NOVO,
17/07/2026 - 06:47:34,2º PPP,WALLACE FERREIRA DA SILVA,40002198,Analista,Ciência de Dados,Desistente,,,ALTERADO,COLOCAÇÃO: 13º AC → 2º PPP
