DATA / HORA,COLOCAÇÃO,NOME,OPÇÃO,CARGO,SUBÁREA,STATUS,UNIDADE,LOTAÇÃO,EVENTO,ALTERACOES
07/07/2026 - 07:45:45,6º AC,HELMA DE JESUS SOUSA E SILVA,40001393,Técnico,Novas Tecnologias,Convocado,CPAF/RO - Rondônia,Vilhena,NOVO,
07/07/2026 - 07:45:45,23º AC,CRISTIANE MARTINS BESERRA,40002271,Analista,"Administrativo, Suprimento, Manutenção e Serviços",Convocado,,,NOVO,
07/07/2026 - 07:45:45,4º AC,EDGARD HENRIQUE COSTA SILVA,40000528,Pesquisador,Sistema de Produção de Olerícolas,Aceitou,CPAF/RR - Roraima,Boa Vista,NOVO,
07/07/2026 - 07:45:45,55º AC,BRUNA DO NASCIMENTO BASSI,40000188,Técnico,Laboratório,Convocado,,,NOVO,
07/07/2026 - 07:45:45,22º AC,EMERSON JOSE DE ARAUJO,40002271,Analista,"Administrativo, Suprimento, Manutenção e Serviços",Aceitou,CENARGEN,Brasília,NOVO,
07/07/2026 - 07:45:45,54º AC,FRANCINE CONCEICAO DE ANDRADE,40000188,Técnico,Laboratório,Desistente,,,NOVO,
07/07/2026 - 07:45:45,28º AC,FELIPE CABRAL CONDE,40000127,Técnico,Suporte à Gestão,Convocado,CPPSUL - Pec Sul,Bagé,NOVO,
07/07/2026 - 07:45:45,21º AC,VITOR REBELLO,40002271,Analista,"Administrativo, Suprimento, Manutenção e Serviços",Desistente,,,ALTERADO,STATUS: Convocado → Desistente
