DATA / HORA,COLOCAÇÃO,NOME,OPÇÃO,CARGO,SUBÁREA,STATUS,UNIDADE,LOTAÇÃO,EVENTO,ALTERACOES
27/04/2026 - 07:06:58,30º AC,VINICIUS DE SOUZA RIOS,40000084,Técnico,Manejo Vegetal,Aceitou,CNPMS - Milho e Sorgo,Sete Lagoas,ALTERADO,STATUS: Convocado → Aceitou; UNIDADE:  → CNPMS - Milho e Sorgo; LOTAÇÃO:  → Sete Lagoas
27/04/2026 - 09:16:35,7º PPP,CARLOS MACIEL LIMA DA SILVA CENCI,40000084,Técnico,Manejo Vegetal,Convocado,,,NOVO,
27/04/2026 - 09:16:35,9º PPP,WILLY FORTUNA SANTOS CARVALHO,40000188,Técnico,Laboratório,Aceitou,CENARGEN,Brasília,NOVO,
27/04/2026 - 09:16:35,34º AC,CAIO CARVALHO DE LIMA,40000188,Técnico,Laboratório,Aceitou,CNPAF - Arroz e Feijão,Santo Antônio de Goiás,ALTERADO,STATUS:  → Aceitou; UNIDADE:  → CNPAF - Arroz e Feijão; LOTAÇÃO:  → Santo Antônio de Goiás
27/04/2026 - 11:57:40,35º AC,CASSIO NAZARENO SILVA DA SILVA,40000188,Técnico,Laboratório,Desistente,,,NOVO,
