DATA / HORA,COLOCAÇÃO,NOME,OPÇÃO,CARGO,SUBÁREA,STATUS,UNIDADE,LOTAÇÃO,EVENTO,ALTERACOES
12/06/2026 - 08:35:19,11º PPP,DAYANANDRA PEREIRA DE ABREU,40000188,Técnico,Laboratório,Desistente,,,ALTERADO,STATUS: Convocado → Desistente
12/06/2026 - 08:35:19,5º PPP,VINICIUS SORIANO SANTOS,40002271,Analista,"Administrativo, Suprimento, Manutenção e Serviços",Convocado subjudice,CNAT - Alimentos,Maceió,ALTERADO,UNIDADE:  → CNAT - Alimentos; LOTAÇÃO:  → Maceió
12/06/2026 - 11:34:54,7º AC,JEFFERSON DE OLIVEIRA COSTA,40000373,Pesquisador,Agricultura e Climatologia,Aceitou,CPAA - Amaz. Ocidental,Manaus,ALTERADO,STATUS: Convocado → Aceitou
12/06/2026 - 11:34:54,5º PPP,VINICIUS SORIANO SANTOS,40002271,Analista,"Administrativo, Suprimento, Manutenção e Serviços",Aceitou subjudice,CNAT - Alimentos,Maceió,ALTERADO,STATUS: Convocado subjudice → Aceitou subjudice
12/06/2026 - 14:31:34,12º PPP,LARISSA SILVA COUTO,40000188,Técnico,Laboratório,Convocado,,,NOVO,
12/06/2026 - 14:31:34,3º PPP,JAZIEL LIMA DE FREITAS,40001648,Analista,Análise de Dados,Aceitou,CNPGL - Gado Leite,Juiz de Fora,ALTERADO,STATUS: Convocado → Aceitou
12/06/2026 - 14:31:34,1º PCD,EDIVANIO RODRIGUES DE ARAUJO,40001565,Pesquisador,Fitopatologia,Reconvocado,CPAF/RO - Rondônia,Porto Velho,ALTERADO,STATUS: Desistente → Reconvocado; UNIDADE: CPAF/RR - Roraima → CPAF/RO - Rondônia; LOTAÇÃO: Boa Vista → Porto Velho
12/06/2026 - 16:53:09,2º AC,CARLOS MIGUEL SIMOES DA SILVA,40001887,Pesquisador,Tecnologia e Utilização de Produtos Florestais,Convocado,CPATU - Amaz. Oriental,Belém,NOVO,
12/06/2026 - 16:53:09,1º PCD,EDIVANIO RODRIGUES DE ARAUJO,40001565,Pesquisador,Fitopatologia,Desistente,CPAF/RR - Roraima,Boa Vista,ALTERADO,STATUS: Reconvocado → Desistente; UNIDADE: CPAF/RO - Rondônia → CPAF/RR - Roraima; LOTAÇÃO: Porto Velho → Boa Vista
